{
  "$schema": "./schemas/risk-catalog.schema.json",
  "catalogId": "risk_catalog_v1",
  "catalogMeta": {
    "releaseId": "lexy-r0-2026-09-12",
    "version": "1.0.0-draft.1",
    "effectiveFrom": null,
    "effectiveTo": null,
    "status": "draft_pending_legal_approval",
    "updatedBy": "Manus AI",
    "updatedAt": "2026-09-12T18:40:24Z",
    "sourceCommit": "78e2f89e99340a403ce389eada223da6bf336676",
    "legalReviewNotice": "Юридическая проверка и утверждение не выполнены; требуется юридическое согласование."
  },
  "governance": {
    "normativeRequirements": [
      {
        "id": "NORM-TZ-13-2",
        "source": "ТЗ v3 §13.2",
        "requirement": "Каталог покрывает критические категории: права на ключевые активы, чувствительные данные, локализацию, B2C-условия, регулируемую деятельность, споры и контроль над критическими доступами."
      },
      {
        "id": "NORM-TZ-13-3",
        "source": "ТЗ v3 §13.3",
        "requirement": "Риски с критическим override или обязательной экспертной квалификацией предусматривают ручную проверку и не должны вести к предложению фиксированного пакета как достаточного решения."
      },
      {
        "id": "NORM-TZ-13-4",
        "source": "ТЗ v3 §13.4",
        "requirement": "Условия активации, уровни, override и эскалации определяются только детерминированными правилами rules_v1; в настоящем каталоге предикаты по ответам отсутствуют."
      },
      {
        "id": "NORM-TZ-14-4",
        "source": "ТЗ v3 §14.4",
        "requirement": "Автоматический статус подтверждения документом допустим только при выполнении всех требований ТЗ; в Release 0 он не разрешён."
      },
      {
        "id": "NORM-TZ-21",
        "source": "ТЗ v3 §21",
        "requirement": "Каждое определение риска имеет стабильный идентификатор, метаданные версии, домен, доказательственные требования, основания, допустимые формулировки, действия и срок дорожной карты."
      }
    ],
    "projectDecisions": [
      {
        "id": "DESIGN-R0-001",
        "decision": "Каталог содержит ровно 25 определений риска в девяти доменах, предусмотренных ТЗ."
      },
      {
        "id": "DESIGN-R0-002",
        "decision": "Все ссылки на правовые основания и формулировки представлены только идентификаторами будущих независимых каталогов; тексты норм, санкций и утверждённые формулировки здесь не дублируются."
      },
      {
        "id": "DESIGN-R0-003",
        "decision": "До отдельной реализации Release 2 автоматическое документарное подтверждение для всех рисков запрещено; базовый статус доказательности — «по данным анкеты». "
      },
      {
        "id": "DESIGN-R0-004",
        "decision": "Поле criticalOverride показывает допустимость жёсткого override для rules_v1, но не является условием по ответу и не заменяет правило."
      },
      {
        "id": "DESIGN-R0-005",
        "decision": "Допустимые коды рекомендаций являются проектными идентификаторами для recommendation_mapping_v1; rules_v1 и mapping обязаны вернуть ровно один код."
      }
    ],
    "openQuestions": [
      {
        "id": "OQ-R0-001",
        "question": "Требуется юридическое согласование всех идентификаторов правовых оснований и допустимых формулировок до их использования в клиентском отчёте."
      },
      {
        "id": "OQ-R0-002",
        "question": "Требуется утвердить детальные predicates rules_v1, включая пороги, сочетания ответов, противоречия и disabled-trigger follow-up."
      },
      {
        "id": "OQ-R0-003",
        "question": "Требуется согласовать состав и коды продуктовой линейки в recommendation_mapping_v1; текущие коды не являются утверждённым коммерческим предложением."
      },
      {
        "id": "OQ-R0-004",
        "question": "Требуется отдельно подтвердить правила документарного анализа, включая чувствительные категории и ручную проверку, до Release 2."
      }
    ]
  },
  "coverage": {
    "domainCoverage": {
      "ip": [
        "LEXR0-RISK-004",
        "LEXR0-RISK-005",
        "LEXR0-RISK-006",
        "LEXR0-RISK-007",
        "LEXR0-RISK-008"
      ],
      "personal_data": [
        "LEXR0-RISK-009",
        "LEXR0-RISK-010",
        "LEXR0-RISK-011",
        "LEXR0-RISK-012"
      ],
      "contracts": [
        "LEXR0-RISK-013",
        "LEXR0-RISK-014",
        "LEXR0-RISK-015"
      ],
      "payments": [
        "LEXR0-RISK-016",
        "LEXR0-RISK-017"
      ],
      "consumer": [
        "LEXR0-RISK-018",
        "LEXR0-RISK-019"
      ],
      "marketing": [
        "LEXR0-RISK-020"
      ],
      "partners": [
        "LEXR0-RISK-021",
        "LEXR0-RISK-022"
      ],
      "regulation": [
        "LEXR0-RISK-023",
        "LEXR0-RISK-024",
        "LEXR0-RISK-025"
      ],
      "corporate": [
        "LEXR0-RISK-001",
        "LEXR0-RISK-002",
        "LEXR0-RISK-003"
      ]
    },
    "criticalTriggerCoverage": [
      {
        "id": "CT-TZ-13-2-01",
        "requirement": "Не подтверждены права на ключевые активы.",
        "riskIds": [
          "LEXR0-RISK-004",
          "LEXR0-RISK-005",
          "LEXR0-RISK-006",
          "LEXR0-RISK-008"
        ]
      },
      {
        "id": "CT-TZ-13-2-02",
        "requirement": "Обрабатываются медицинские, биометрические данные или данные детей без ясной правовой модели.",
        "riskIds": [
          "LEXR0-RISK-009"
        ]
      },
      {
        "id": "CT-TZ-13-2-03",
        "requirement": "Данные российских пользователей хранятся за рубежом либо место хранения неясно.",
        "riskIds": [
          "LEXR0-RISK-010"
        ]
      },
      {
        "id": "CT-TZ-13-2-04",
        "requirement": "Есть значимые B2C-продажи без ясных условий оплаты, возврата и ограничения ответственности.",
        "riskIds": [
          "LEXR0-RISK-017",
          "LEXR0-RISK-018"
        ]
      },
      {
        "id": "CT-TZ-13-2-05",
        "requirement": "Продукт относится к регулируемой сфере без проверки специальных требований.",
        "riskIds": [
          "LEXR0-RISK-023",
          "LEXR0-RISK-024"
        ]
      },
      {
        "id": "CT-TZ-13-2-06",
        "requirement": "Есть спор, проверка, предписание или требование удалить ключевой актив.",
        "riskIds": [
          "LEXR0-RISK-003",
          "LEXR0-RISK-006",
          "LEXR0-RISK-012",
          "LEXR0-RISK-025"
        ]
      },
      {
        "id": "CT-TZ-13-2-07",
        "requirement": "При подготовке к инвестициям, продаже или Enterprise-проверке есть разрывы в правах, данных или договорах.",
        "riskIds": [
          "LEXR0-RISK-002",
          "LEXR0-RISK-005",
          "LEXR0-RISK-010",
          "LEXR0-RISK-013",
          "LEXR0-RISK-014",
          "LEXR0-RISK-015"
        ]
      },
      {
        "id": "CT-TZ-13-2-08",
        "requirement": "Домены, репозитории, облака или ключевые доступы контролируются подрядчиком либо бывшим сотрудником.",
        "riskIds": [
          "LEXR0-RISK-008"
        ]
      }
    ],
    "currentQuestionnaireBranchCoverage": [
      {
        "branchId": "block_consumer",
        "riskIds": [
          "LEXR0-RISK-017",
          "LEXR0-RISK-018",
          "LEXR0-RISK-019",
          "LEXR0-RISK-020"
        ]
      },
      {
        "branchId": "block_investment",
        "riskIds": [
          "LEXR0-RISK-002",
          "LEXR0-RISK-003",
          "LEXR0-RISK-005",
          "LEXR0-RISK-010",
          "LEXR0-RISK-013",
          "LEXR0-RISK-014",
          "LEXR0-RISK-015"
        ]
      },
      {
        "branchId": "block_partners",
        "riskIds": [
          "LEXR0-RISK-016",
          "LEXR0-RISK-021",
          "LEXR0-RISK-022"
        ]
      },
      {
        "branchId": "block_contractors",
        "riskIds": [
          "LEXR0-RISK-004",
          "LEXR0-RISK-005",
          "LEXR0-RISK-007",
          "LEXR0-RISK-008"
        ]
      }
    ],
    "note": "Карта покрытия фиксирует только связь доменов и контекстов с определениями риска. Условия по конкретным ответам, комбинации и приоритеты должны находиться исключительно в rules_v1."
  },
  "riskDefinitions": [
    {
      "id": "LEXR0-RISK-001",
      "objectMeta": {
        "releaseId": "lexy-r0-2026-09-12",
        "version": "1.0.0-draft.1",
        "effectiveFrom": null,
        "effectiveTo": null,
        "status": "draft_pending_legal_approval",
        "updatedBy": "Manus AI",
        "updatedAt": "2026-09-12T18:40:24Z",
        "sourceCommit": "78e2f89e99340a403ce389eada223da6bf336676",
        "legalReviewNotice": "Юридическая проверка и утверждение не выполнены; требуется юридическое согласование."
      },
      "domain": "corporate",
      "title": "Деятельность ведётся без подтверждённой организационно-правовой основы",
      "defaultSeverity": "critical",
      "criticalOverride": true,
      "evidenceRequirements": {
        "questionnaireEvidence": [
          "b2_q1"
        ],
        "documentEvidence": [
          "Учредительные документы и сведения о лице, ведущем деятельность"
        ],
        "automaticDocumentConfirmationAllowed": false,
        "defaultEvidenceStatus": "questionnaire_based",
        "evidencePolicyNote": "В Release 0 сведения анкеты являются исходными данными; автоматическое подтверждение документом не допускается до отдельного согласования правил и документарного контура."
      },
      "allowedLegalBasisIds": [
        "LB-RU-CORP-001"
      ],
      "approvedLanguageIds": [
        "PH-RISK-001-V1"
      ],
      "businessImpacts": [
        "Риск невозможности надлежащим образом заключать договоры и принимать платежи.",
        "Риск блокировки масштабирования и привлечения контрагентов."
      ],
      "requiredActions": [
        "Определить лицо, через которое ведётся деятельность, и оформить его полномочия.",
        "Проверить корпоративные и регистрационные документы до продолжения масштабирования."
      ],
      "roadmapPeriod": "immediate",
      "manualReviewRequired": true,
      "allowedRecommendationProductCodes": [